{
  "schemaVersion": "1.0",
  "id": "webscene.backend.avalonia",
  "displayName": "WebScene Avalonia Backend",
  "version": "11.3.4",
  "assembly": "WebScene.Backend.Avalonia",
  "backendType": "WebScene.Backends.Avalonia.AvaloniaBackendHost",
  "maximumSupportLevel": "Advanced",
  "capabilities": [
    "DomProjection",
    "CssLayout",
    "Canvas2D",
    "Svg",
    "Images",
    "PointerInput",
    "KeyboardInput",
    "TextInput",
    "Focus",
    "Clipboard",
    "Accessibility",
    "InputMethodEditor",
    "OpenGl"
  ],
  "targetFrameworks": ["net8.0", "net10.0"],
  "platforms": ["desktop", "headless"]
}
